qid,question,group,instruction_type,run,instruction_used,step,text,n_tokens
2hop__635544_110949,What is the date of birth of the person who was part of Ratata?,style,paraphrase,0,,0,"Shirley Abicair. Shirley Abicair was born in Melbourne, Victoria, Australia. Some sources show her year of birth as 1935, but a contemporary account shows she was 23 or 24 on arrival in Britain and, as she had completed tertiary studies in Australia, the earlier date seems more likely. She was the only daughter of a Wing Commander in the RAAF.

Anno Domini. This calendar era is based on the traditionally reckoned year of the conception or birth of Jesus of Nazareth, with AD counting years from the start of this epoch, and BC denoting years before the start of the era. There is no year zero in this scheme, so the year AD 1 immediately follows the year 1 BC. This dating system was devised in 525 by Dionysius Exiguus of Scythia Minor, but was not widely used until after 800.

Švitrigaila. Švitrigaila was born to Algirdas, Grand Duke of Lithuania, and his second wife Uliana of Tver. His date of birth is unknown, but it is believed that he was the youngest or second youngest son of Algirdas. He first appeared in politics in October 1382 when he witnessed the Treaty of Dubysa between his elder brother Jogaila and the Teutonic Knights. Historians believe that would indicate that at the time Švitrigaila was no younger than 12 which would put his date of birth sometime before 1370. In a complaint submitted to the Council of Florence, Švitrigaila claimed that he and Jogaila were favorite sons of Algirdas. Before his death in 1377, Algirdas transferred his throne to Jogaila but made him swear to make Švitrigaila his heir. Jogaila's representatives did not outright deny the arrangement and instead claimed that it had been modified by mutual agreement between the brothers.

Natural-born-citizen clause. The U.S. Constitution uses but does not define the phrase ``natural born Citizen '', and various opinions have been offered over time regarding its precise meaning. The consensus of early 21st - century constitutional scholars, together with relevant case law, is that natural - born citizens include, subject to exceptions, those born in the United States. Many scholars have also concluded that those who meet the legal requirements for U.S. citizenship`` at the moment of birth'', regardless of place of birth, are also natural - born citizens. Every president to date was either a citizen at the adoption of the Constitution in 1789 or was born in the United States; of these there have been seven that had at least one parent who was not born on U.S. soil.

Australia Day. The meaning and significance of Australia Day has evolved over time. Unofficially, or historically, the date has also been variously named ``Anniversary Day '',`` Foundation Day'', and ``ANA Day ''. 26 January 1788 marked the proclamation of British sovereignty over the eastern seaboard of Australia (then known as New Holland). Although it was not known as Australia Day until over a century later, records of celebrations on 26 January date back to 1808, with the first official celebration of the formation of New South Wales held in 1818. On New Year's Day 1901, the British colonies of Australia formed a federation, marking the birth of modern Australia. A national day of unity and celebration was looked for. It was not until 1935 that all Australian states and territories adopted use of the term`` Australia Day'' to mark the date, and not until 1994 that the date was consistently marked by a public holiday on that day by all states and territories.

Giovanni Cifolelli. Giovanni Cifolelli was an Italian mandolin virtuoso and dramatic composer whose date and place of birth are unknown. In 1764 he made his appearance in Paris as a mandolin virtuoso and was highly esteemed, both as a performer and teacher. He published his ""Method for the mandolin"" while residing in Paris, which met with great success throughout France, being the most popular of its period.

Maureen Payne. Maureen Payne (date of birth unknown, died 1997, South Africa) was a South Africa Test cricketer. She captained the side for their second series, played against New Zealand in 1971–72. She appeared in five Tests for South Africa, claiming eight wickets.

List of Dragon Ball Super episodes. Name Date Discs Episodes Part One July 25, 2017 01 -- 13 Part Two October 3, 2017 14 -- 26 Part Three February 20, 2018 27 -- 39

Streams of Expression. Streams of Expression is the 20th studio album by American jazz musician Joe Lovano to be released on the Blue Note label. It was released in 2006 and features a five-part ""Streams of Expression Suite,"" three-part ""Birth of the Cool Suite,"" and three other shorter works. The ""Birth of the Cool Suite"" was conducted by Gunther Schuller and utilizes melodic themes inspired by Miles Davis' work from his 1948 and 1950 nonet. The album also features George Garzone, Ralph Lalama, Gary Smulyan, and Tim Hagans.

Pir Syed Muhammad Binyamin Rizvi. Pir Syed Muhammad Binyamin Rizvi (Urdu: پیر سید محمد بنیامین رضوی)date of Birth 15 Aug 1959 date of Death 24 June 2004) was a Pakistani politician. He was the oldest son of Pir Syed Mohammad Yaqoob Shah (a famous spiritual and religious scholar, and member of provincial assembly who died on 31 August 1991). On 24 June 2004 he was brutally murdered in Lahore near his House. He is buried next to his father late Pir Syed Mohammad Yaqoob Shah in his home town Phalia.

La naissance d'Osiris. La naissance d'Osiris, ou La fête Pamilie (""The Birth of Osiris, or The Festival of Pamylia"") is a one-act opera by Jean-Philippe Rameau, first performed on 12 October 1754 at Fontainebleau to celebrate the birth of the future King Louis XVI. The libretto is by Rameau's frequent collaborator Louis de Cahusac. Cahusac styled the work a ""ballet allégorique"" (""allegorical ballet""), but it is usually categorised as an ""acte de ballet"". Its slender plot tells of Jupiter's announcement to a group of Egyptian shepherds of the birth of the god Osiris, who symbolises the baby prince. The piece may have started life as part of a larger work, ""Les beaux jours de l'Amour"", an ""opéra-ballet"" Rameau and Cahusac planned but never completed for reasons which are still uncertain.

Sue Ryder. Her birth and death certificates both put the date one year later, on 3 July 1924, as does a plaque unveiled in honour of Sue Ryder and Leonard Cheshire in Cavendish Church in Suffolk. At the beginning of the war, Ryder volunteered to the First Aid Nursing Yeomanry, even though she was only 15. To get in, she lied about her age and seems to have maintained the deception for the rest of her life.

Pak Nam-gi. Pak Nam-gi or Park Nam-ki (21 February 1934 – 17 March 2010) was, until as late as January 2010, Director of the Planning and Finance Department of the ruling party of North Korea. There are doubts about his date of birth, with at least two unattributed sources reporting it as 21 February 1934 or sometime in 1928 respectively.

William Shakespeare. William Shakespeare was the son of John Shakespeare, an alderman and a successful glover (glove-maker) originally from Snitterfield, and Mary Arden, the daughter of an affluent landowning farmer. He was born in Stratford-upon-Avon and baptised there on 26 April 1564. His actual date of birth remains unknown, but is traditionally observed on 23 April, Saint George's Day. This date, which can be traced to a mistake made by an 18th-century scholar, has proved appealing to biographers because Shakespeare died on the same date in 1616. He was the third of eight children, and the eldest surviving son.

List of Soul Eater episodes. Partial box sets (DVD only) Name Release date Discs Episodes Part One February 9, 2010 1 - 13 Part Two March 30, 2010 14 - 26 Part Three June 1, 2010 27 - 39 Part Four July 27, 2010 40 - 51

Conscription in Australia. In 1964 compulsory National Service for 20 - year - old males was introduced under the National Service Act (1964). The selection of conscripts was made by a sortition or lottery draw based on date of birth, and conscripts were obligated to give two years' continuous full - time service, followed by a further three years on the active reserve list. The full - time service requirement was reduced to eighteen months in October 1971.

Clara Morris. Clara Morris (March 17, 1849 – November 20, 1925) (her birth date is sometimes given as 1846/48) was an American actress.

Ratata (band). Ratata was a Swedish pop group fronted by Swedish vocalist Mauro Scocco formed in 1980. It functioned as a 4-piece band until 1983, when it was disbanded. But Johan Ekelund having played with the band briefly continued to cooperate with Scocco continuing as a duo until 1989. The duo had a brief comeback in 2002.

Yang Meng. Yang Meng was the third son of Yang Xingmi, a major warlord at the end of Tang Dynasty as the military governor (""Jiedushi"") of Huainan Circuit (淮南, headquartered in modern Yangzhou, Jiangsu). It is not known when he was born, although his immediately older brother Yang Longyan was born in 897 and his immediately younger brother Yang Pu was born in 900, placing a timeframe on his birth date. His mother's name was not recorded in history.

Mauro Scocco. Mauro Scocco (born 11 September 1962) is a Swedish pop artist of Italian descent. He has been described as ""one of the sharpest songwriters in Sweden"". Scocco was the singer for the pop group Ratata (1980–83) transformed into a duo with Johan Ekelund (1983–89). After Ratata, Scocco has continued as a solo artist since. In 2014, he cooperated with Plura Jonsson releasing a joint album as ""Mauro & Plura"".",2308
2hop__635544_110949,What is the date of birth of the person who was part of Ratata?,style,paraphrase,0,Paraphrase this.,1,"Mauro Scocco, a Swedish pop artist of Italian heritage, was born on September 11, 1962. He is recognized as one of Sweden’s most incisive lyricists. Scocco began his career as the lead vocalist of the pop group Ratata, which functioned as a four-piece band until 1983, after which it became a duo with Johan Ekelund until 1989. Following the dissolution of Ratata, Scocco pursued a solo career. In 2014, he collaborated with Plura Jonsson, releasing an album under the name ""Mauro & Plura.""",124
2hop__635544_110949,What is the date of birth of the person who was part of Ratata?,style,paraphrase,0,Paraphrase this.,2,"Mauro Scocco, a Swedish pop singer with Italian roots, was born on September 11, 1962, and is esteemed for his sharp and insightful songwriting. Initially fronting the group Ratata, which operated as a quartet until 1983 and then as a duo with Johan Ekelund until 1989, Scocco transitioned to a solo artist after the band disbanded. In 2014, he teamed up with Plura Jonsson to release an album credited to ""Mauro & Plura.""",108
2hop__635544_110949,What is the date of birth of the person who was part of Ratata?,style,paraphrase,0,Paraphrase this.,3,"Mauro Scocco, a Swedish pop vocalist of Italian heritage, was born on September 11, 1962, and is recognized for his incisive and thoughtful lyrics. He originally led the band Ratata, which functioned as a four-piece until 1983 and then as a duo with Johan Ekelund until 1989, before embarking on a solo career following the group's dissolution. In 2014, he collaborated with Plura Jonsson to put out an album under the name ""Mauro & Plura.""",110
